{"iter": 0, "kind": "baseline", "name": "default", "score": 15000.0, "min_success": 0.0, "decision": "KEEP", "decision_reason": "baseline"}
{"iter": 1, "kind": "param", "name": "use_rrt_connect=true", "hypothesis": "A_straight 0% because unidirectional RRT* can't thread the ~110m side-corridor detour within the 3s timeout (z-sampling clamped to [-6,0] forbids over-wall route; goal_sample_rate is a dead knob, _smart_sample hardcodes 0.2). Bidirectional RRT-Connect's greedy connect marches through the wide corridor reliably -> converts 15000 in failure penalties into real profile energies.", "score": 3191.2230972712337, "min_success": 1.0, "decision": "KEEP", "decision_reason": "score 15000->3191.2, min_success 0.0->1.0 (all 3 scenarios 100%)"}
{"iter": 2, "kind": "code", "name": "smoother: proxy-guided local search (remove/move/chamfer/split)", "hypothesis": "A_straight wastes ~930J/run because sharp corners (e.g. 98.6deg overshoot corner at x=74.7) cap entire adjacent long legs at v_turn=sqrt(3*min(L1,L2)/theta). Metric rewards few corners with long balanced legs, NOT fine arcs (chords shrink min(L) -> slower). Proxy-guided moves (vertex remove/relocate, coarse chamfer, collinear split to isolate slow zones) with e/m(v)~150/v-1.6 fit should recover most of it.", "score": 2694.251263609961, "min_success": 1.0, "decision": "KEEP", "decision_reason": "score 3191.2->2694.3 (-15.6%), min_success 1.0 kept; A 1602->1164J, B 899->848J, C 690->682J"}
{"iter": 3, "kind": "code", "name": "smoother v3: +split-bend compound move, relocation reach 16m + diagonals", "hypothesis": "A residual ~480J sits in the 2 topologically unavoidable corners (~70-82deg final corner caps ~58m at ~7m/s). Single moves can't split a sharp corner into two gentle long-legged ones (collinear split alone shrinks minL -> proxy worse -> rejected = local minimum); compound insert+perpendicular-bend in one candidate escapes it.", "score": 2540.425235689478, "min_success": 1.0, "decision": "KEEP", "decision_reason": "score 2694.3->2540.4 (-5.7%); A 1164->1055J, B 848->839J, C 682->646J"}
{"iter": 4, "kind": "code", "name": "smoother v4: +double-bend move (replace sharp corner with two spread vertices)", "hypothesis": "Remaining sharp corridor corners (~70deg, vcap~7) need two-gentle-corner geometry; single insertions reach it only via multi-move sequences the greedy proxy rejects midway; a one-candidate double-bend (remove P, insert Q1,Q2 outward) reaches it directly.", "score": 2537.7984676531773, "min_success": 1.0, "decision": "KEEP", "decision_reason": "score 2540.4->2537.8 (-0.1%, A only 1055->1053; B/C unchanged) — smoother lever saturating, next try planner-side"}
{"iter": 5, "kind": "param", "name": "step_size=3.0", "hypothesis": "Smoother saturated; residual is raw-skeleton quality. Longer greedy RRT-Connect strides (3.0m vs 1.5m) give straighter skeletons and better topology in the ~8-10m corridors -> lower post-smoothing energy at same success.", "score": 2328.9327525981603, "min_success": 1.0, "decision": "KEEP", "decision_reason": "score 2537.8->2328.9 (-8.2%); B 839->650J (bad-topology run gone), A 1053->1030J, C 646->649J"}
{"iter": 6, "kind": "param", "name": "step_size=4.5", "hypothesis": "step_size ladder continues: 3.0 gained 8.2%, corridors ~8-10m still admit 4.5m strides -> straighter skeletons.", "score": 2294.7614345088, "min_success": 1.0, "decision": "KEEP", "decision_reason": "score 2328.9->2294.8 (-1.5%); A 1030->1009J, B 650->637J, C ~flat — diminishing returns"}
{"iter": 7, "kind": "param", "name": "step_size=6.0", "hypothesis": "If skeleton straightness still binds, 6.0m strides gain a bit more; if the corner-geometry floor dominates, this rung flatlines.", "score": 2347.460936118832, "min_success": 1.0, "decision": "REVERT", "decision_reason": "score 2347.5 > best 2294.8 (A 1025, B 664, C 659 — all slightly worse; ladder peaked at 4.5, big strides overshoot in corridors)"}
{"iter": 8, "kind": "code", "name": "smoother v5: 3D climb/descent proxy + over-wall macro-route probe (REJECTED)", "hypothesis": "Frozen BEMT makes descent nearly free (desc@12=1.6 J/m vs level 8.2, climb 15.1) -> over-wall climb-cruise-descend template (true 582J idealized) should beat the 93m lateral detour (1205J); inject templates + climb-aware proxy.", "score": 2327.8518904211796, "min_success": 1.0, "decision": "REVERT", "decision_reason": "score 2327.9 > best 2294.8. Probe never fired: symmetric f2<=0.8 templates descend INTO Row4's back face (descent must start after x~64, f2~0.92) -> all collision-rejected; meanwhile descent-credit proxy encouraged z-wiggles in local moves, A 1009->1043. Idea stays alive: feasible steep-descent over-wall estimates ~840J vs 1009. Next: f2 grid {0.85,0.9,0.95}, conservative descent credit (K_DN=1.0, floor 15W), limit z-relocation steps."}
{"iter": 9, "kind": "code", "name": "smoother v6: late-descent templates + conservative descent credit (REJECTED)", "hypothesis": "v5's probe failed on template feasibility (descent through Row4); f2 in {0.8..0.95} + K_DN=1.0/floor15 + capped z-steps should let the over-wall route fire.", "score": 2328.6401197421255, "min_success": 1.0, "decision": "REVERT", "decision_reason": "score 2328.6 > best 2294.8; probe STILL never fired — raw 4-pt template proxy is dominated by the steep-descent corner capping the whole ~59m cruise (phantom-cap), while the incumbent path is compared post-polish. Probe must polish templates BEFORE comparing (and collision-check before the proxy gate). A's +34J regression = proxy-shape side effect on local moves."}
{"iter": 10, "kind": "code+episode", "name": "smoother v7: polish-before-compare over-wall probe (3D ranker) [episode boundary: lit search distilled into KNOWLEDGE]", "hypothesis": "Over-wall (~840J true) loses to lateral (1009J) only in raw-template proxy form (steep-descent corner phantom-caps the cruise leg); collision-check first, polish feasible templates with the unchanged v4 sweeps, compare via climb-aware 3D ranker -> probe fires where it truly wins.", "score": 2084.0061209565006, "min_success": 1.0, "decision": "KEEP", "decision_reason": "score 2294.8->2084.0 (-9.2%); A 1009->798.6J (-21%, over-wall route adopted), B/C identical to v4 (probe correctly selective)"}
{"iter": 11, "kind": "code", "name": "smoother v8: 3D-aware re-polish after level polish (NO-OP)", "hypothesis": "A's over-wall path wastes ~150J on a level-proxy-shaped hump (z=-15.2 vs needed -11.5, climb ~18.6 J/vertical-m); re-polishing the adopted route with the 3D proxy should lower it.", "score": 2084.0061209565006, "min_success": 1.0, "decision": "REVERT", "decision_reason": "byte-identical to v7 (score equal, not lower). 3D re-polish accepts zero moves: hump removal needs coordinated multi-vertex lowering (single-vertex z-move creates an apex corner, correctly rejected). Next: polish adopted templates with 3D proxy FROM THE START (level pass is what builds the hump), or add a plateau-lowering compound move."}
{"iter": 12, "kind": "code", "name": "smoother v9: 3D-proxy polish from raw template (REJECTED)", "hypothesis": "The -15.2m hump exists because the first polish pass is climb-blind; polishing the raw template directly under the 3D proxy keeps cruise near -11.5 -> A ~700J.", "score": 2191.754837126679, "min_success": 1.0, "decision": "REVERT", "decision_reason": "score 2191.8 > best 2084.0; A 798.6->906.3. CONFIRMED PATTERN: pessimistic level proxy beats accurate 3D proxy for local moves even on climb paths (overestimated mid-speed costs push high-vcap corner geometry the true evaluator rewards more than hump removal). Hump needs a dedicated coordinated-lowering move (3D-accepted) ON TOP of level-proxy polish."}
{"iter": 13, "kind": "code", "name": "smoother v10: coordinated hump-lowering pass (NO-OP)", "hypothesis": "A's hump wastes ~3.4m climb (~60-90J); coordinated run-lowering (3D-accepted, after level polish) removes it where single-vertex moves hit the apex-corner ridge.", "score": 2084.0061209565006, "min_success": 1.0, "decision": "REVERT", "decision_reason": "byte-identical again — every lowering rejected by the 3D proxy itself: the hump BUYS the 26.4m climb leg its uncapped v* (lowering sharpens the apex corner, caps it at ~14 m/s, costing more than the climb saving). A~799J is near the family floor; hump was a correct trade-off, not waste."}
{"iter": 14, "kind": "param+episode", "name": "step_size=5.0 [episode 2 boundary: racing-line lit + corner-conservation law distilled]", "hypothesis": "With v7's probe decoupling A from skeleton quality, B/C dominate step_size sensitivity; their optimum may sit between the tested 4.5 and 6.0 rungs.", "score": 2142.276198125161, "min_success": 1.0, "decision": "REVERT", "decision_reason": "score 2142.3 > best 2084.0; A identical (probe-dominated ✓), B 637->661, C 648->683. step_size ladder fully resolved: 4.5 is a sharp optimum (3.0 < 4.5 > 5.0 > 6.0)."}
{"iter": 15, "kind": "code", "name": "smoother v11: finer probe grid (zc down to -11.2, 5x4 f-grid, top-3 polish)", "hypothesis": "A's template starts from a coarse grid; finer/lower zc seeds the polish in a slightly better basin (~10-30J).", "score": 2081.9979645402614, "min_success": 1.0, "decision": "KEEP", "decision_reason": "score 2084.0->2082.0 (-0.1%); A 798.6->796.6J. Floor confirmed — grid refinement yields only ~2J."}
{"iter": 16, "kind": "param", "name": "max_iterations=10000 (knob resolution probe)", "hypothesis": "RRT-Connect converges far below 5000 iters under the 3s timeout with fixed seeds -> deterministic no-op; confirming closes the last open Layer-1 parameter.", "score": 2081.9979645402614, "min_success": 1.0, "decision": "REVERT", "decision_reason": "byte-identical (score equal). ALL Layer-1 params now resolved: step_size=4.5 optimal, use_rrt_connect essential, max_iterations dead, goal_sample_rate dead (hardcoded 0.2), search_radius/weight_* dead in Connect branch."}
{"iter": 17, "kind": "code", "name": "smoother v12: extended f-grid edges f1=0.05, f2=0.97 (NO-OP)", "hypothesis": "The f-grid may clip the basin edge; gentler-climb/later-descent seeds could give the polish a better start.", "score": 2081.9979645402614, "min_success": 1.0, "decision": "REVERT", "decision_reason": "byte-identical — winning template is interior to the existing grid. Floor 2082.0 confirmed from all directions."}
{"iter": 18, "kind": "code", "name": "smoother v13: skeleton-DP probe (global corner placement over raw vertices)", "hypothesis": "Greedy farthest-first shortcut fixes corners at visibility-jump artifacts; a corner-cap-aware DP over raw polyline vertices finds better min(L)/theta skeletons for B/C; 3D-rank adoption gate protects A.", "score": 2078.4468619035383, "min_success": 1.0, "decision": "KEEP", "decision_reason": "score 2082.0->2078.4; B 637.2->633.6J (DP corner placement), A/C unchanged (gate held)."}
{"iter": 19, "kind": "code", "name": "smoother v14: sweep cap 6->12 (saturation check, NO-OP)", "hypothesis": "Over-wall template polish might still be improving at the 6-sweep cap; raising to 12 finds residual A gains or confirms convergence.", "score": 2078.4468619035383, "min_success": 1.0, "decision": "REVERT", "decision_reason": "byte-identical — polish converges within 6 sweeps on all paths. Local search fully saturated."}
{"iter": 20, "kind": "code+episode", "name": "smoother v15: relocation reach 24m (NO-OP) [episode 3 boundary: seed-overfitting lit distilled]", "hypothesis": "16m relocation cap may truncate far overshoot fixes on some seeds.", "score": 2078.4468619035383, "min_success": 1.0, "decision": "REVERT", "decision_reason": "byte-identical — 16m reach never binding. Episode 3 opened; milestone (summary + seed_val=100 validation + stop) next iteration."}
{"iter": 21, "kind": "milestone", "name": "Milestone 1 (episode 3): summary + held-out validation", "hypothesis": null, "score": 2078.4468619035383, "min_success": 1.0, "decision": "MILESTONE", "decision_reason": "seed_val=100 held-out: tuned 2079.2 (+0.04% vs train, 100% success all scenarios) vs untuned baseline 10684.5 (A 0%). Gains generalize. Loop stopped for user review."}
{"iter": 22, "kind": "sampler", "name": "sampler v1: z-escape global", "hypothesis": "逃 z-clamp 全局采样,使 RRT-Connect 原生找翻墙路线(而非靠平滑器探针)", "score": 2094.2, "min_success": 1.0, "decision": "REVERT", "decision_reason": "no improvement vs 2078.4"}
{"iter": 23, "kind": "sampler", "name": "sampler v2: z-escape targeted", "hypothesis": "只在目标基本正前方(|Δy|<8,即场景A直穿)时逃z,避免污染B/C横向绕行", "score": 2078.4, "min_success": 1.0, "decision": "REVERT", "decision_reason": "no improvement vs 2078.4"}
{"iter": 24, "kind": "sampler", "name": "sampler v3: goal-bias + targeted z", "hypothesis": "10%采目标 + 场景A定向逃z,加速双向树连通同时使能翻墙", "score": 2108.4, "min_success": 1.0, "decision": "REVERT", "decision_reason": "no improvement vs 2078.4"}
{"iter": 25, "kind": "sampler", "name": "sampler v4: vertical-corridor bias", "hypothesis": "场景A定向逃z时,偏置到高空巡航带(z∈[-15,-11],翻墙apex),减少无效中层采样", "score": 2078.4, "min_success": 1.0, "decision": "REVERT", "decision_reason": "no improvement vs 2078.4"}
{"iter": 26, "kind": "code", "name": "smoother v16: +binormal (out-of-plane) relocation direction", "hypothesis": "All current relocation directions (tang/norm/diag/z) lie in each corner's plane; the binormal is the only unexplored move direction — near-zero risk, possible corridor-path gains.", "score": 2075.420762113223, "min_success": 1.0, "decision": "KEEP", "decision_reason": "score 2078.4->2075.4; C 648.3->645.2J (out-of-plane relocation), A/B unchanged."}
{"iter": 27, "kind": "code", "name": "smoother v17: binormal bend directions in split-bend/double-bend (NO-OP)", "hypothesis": "v16's out-of-plane relocation paid on C; extending binormal offsets to vertex-creating moves E/F may find more.", "score": 2075.420762113223, "min_success": 1.0, "decision": "REVERT", "decision_reason": "byte-identical — binormal relocation already captured all out-of-plane gains; bend variants add nothing."}
{"iter": 28, "kind": "code", "name": "smoother v18: basin hopping (perturb +-2m, re-polish, best-of-3 by 3D proxy, full collision regate)", "hypothesis": "All polish variants are deterministic from one start -> single-basin artifacts; seeded perturbation + re-polish samples nearby basins with zero regression risk (strictly gated).", "score": 2068.284154261574, "min_success": 1.0, "decision": "KEEP", "decision_reason": "score 2075.4->2068.3; B 633.6->626.5J (better corner basin), A/C unchanged."}
{"iter": 29, "kind": "code", "name": "smoother v19: basin hopping 6 trials, mixed scales +-2/+-5m (REJECTED)", "hypothesis": "More trials with mixed jump scales sample more basins -> further gains at zero regression risk.", "score": 2070.234808330762, "min_success": 1.0, "decision": "REVERT", "decision_reason": "score 2070.2 > best 2068.3; B 626.5->628.4. More trials shift the RNG stream — v18's winning draws vanish. Basin-hop marginal gains are draw-dependent (~5J noise scale) within the frozen seed protocol, not systematically scalable."}
{"iter": 30, "kind": "code+episode", "name": "smoother v20: CHOMP-style joint gradient refinement [episode 4 EXPLORE: trajectory-optimization family]", "hypothesis": "Discrete coordinate moves cannot cross multi-vertex coupling ridges (hump/apex-cap); CHOMP-family joint continuous descent on the 3D proxy (numerical gradient, collision-gated backtracking since only a boolean oracle exists) optimizes all vertices simultaneously.", "score": 2050.500730660374, "min_success": 1.0, "decision": "KEEP", "decision_reason": "score 2068.3->2050.5 (-0.9%); ALL scenarios improved: A 796.6->789.5 (first A gain in 13 iters), B 626.5->622.1, C 645.2->638.9. EXPLORE family bet validated."}
{"iter": 31, "kind": "code", "name": "smoother v21: discrete-continuous alternation (sweeps->chomp x2)", "hypothesis": "Discrete moves (topology) and joint descent (coupled adjustments) have complementary blind spots; alternating rounds should compound v20's gain.", "score": 2049.911732610864, "min_success": 1.0, "decision": "KEEP", "decision_reason": "score 2050.5->2049.9 (+0.03%, sesame) — B only 622.1->621.6. Hypothesis mostly wrong: v20's single pass already reached joint convergence. Plateau +1 per <1% rule."}
{"iter": 32, "kind": "code", "name": "smoother v22: STOMP-style stochastic refinement (cost-weighted noise averaging)", "hypothesis": "The proxy's kinks (min(), cap saturations) stall gradient descent exactly where line search fails; STOMP's cost-weighted averaging descends through kinks without gradients — last untried family member.", "score": 2049.7841636894586, "min_success": 1.0, "decision": "KEEP", "decision_reason": "score 2049.9->2049.8 (+0.006%, sesame) — C only. Trajectory-optimization family fully harvested: CHOMP -17.8, alternation/STOMP crumbs. Joint convergence reached; plateau +1."}
{"iter": 33, "kind": "code", "name": "smoother v23: gradient cap 60->200 (saturation check, NO-OP)", "hypothesis": "v20's A gain may have been truncated at the 60-iteration gradient cap; raising to 200 finds the rest of the slope or confirms convergence.", "score": 2049.7841636894586, "min_success": 1.0, "decision": "REVERT", "decision_reason": "byte-identical — the CHOMP pass terminates on line-search exhaustion (kink-bound), not budget. Every optimizer in the pipeline now saturation-checked."}
{"iter": 34, "kind": "code+episode", "name": "smoother v24: grid-calibrated 3D surrogate (P_lvl parabola refit; symmetric +-16.8 sin(th) climb/descent; zero floor) [episode 5 EXPLORE: offline surrogate calibration]", "hypothesis": "CHOMP descends on _proxy3d; its hand-fit constants (3 probe points) misprice climb +10%/descent -12% and miss the 0-clamp (steep fast descent is FREE). Grid-calibrating the surrogate moves ranking + gradient endpoints closer to the true optimum.", "score": 2046.4107216055302, "min_success": 1.0, "decision": "KEEP", "decision_reason": "score 2049.8->2046.4 (+0.16%); ALL scenarios improved slightly (A 789.5->787.0). Systematic but sub-1% -> plateau +1."}
{"iter": 35, "kind": "code", "name": "smoother v25: deeper template zc grid -13.5/-14.5 (NO-OP)", "hypothesis": "Polish lifts A's cruise to -15.2 from shallow seeds anyway; seeding deep under the calibrated symmetric surrogate might land a better basin. Also verified: the free-dive shortcut is geometrically blocked (direct dive passes through Row4; post-wall dive too sharp -> capped below the free-descent speed threshold).", "score": 2046.4107216055302, "min_success": 1.0, "decision": "REVERT", "decision_reason": "byte-identical. A ~787J decomposes as near-optimal climb (320J~floor) + optimal high cruise + ~160J corner-cap-bound slow zones = conservation floor."}
{"iter": 36, "kind": "verdict", "name": "formal exhaustion report (no proposal)", "hypothesis": "Per anti-idle discipline: all movable components are saturation-checked — A=787J at conservation floor (climb 320J≈physics min, ~160J corner-cap-locked, free-dive geometrically blocked), B/C corner-tax conserved, params resolved, 5 algorithm families (discrete local search, macro templates, skeleton DP, basin hopping, CHOMP/STOMP) converge to the same fixed point 2046.4.", "score": 2046.4107216055302, "min_success": 1.0, "decision": "EXHAUSTED", "decision_reason": "Search space within current rules (Layer-1 params + smoother + sampler injection, frozen scenarios/physics) is exhausted. Needs a new direction in program.md: options 3 (richer scenarios — real 3D energy headroom) or 4 (speed as a planner decision — new optimization dimension) are where genuine headroom lives."}
{"iter": 37, "kind": "code+episode", "name": "smoother v26: 5-point descent-knee templates (NO-OP) [episode 6 boundary: VRS/WBS descent-profile lit distilled]", "hypothesis": "Seed the two-stage descent knee the polish always rediscovers (real-rotorcraft diagonal-descent profiles corroborate the shape) so CHOMP refines instead of discovers.", "score": 2046.4107216055302, "min_success": 1.0, "decision": "REVERT", "decision_reason": "byte-identical — polish converges to the same fixed point from 4-pt or 5-pt seeds. Exhaustion verdict survives its own final test. Milestone 2 next iteration."}
{"iter": 38, "kind": "milestone", "name": "Milestone 2 (episode 6): summary + comparison + robustness + held-out", "hypothesis": null, "score": 2046.4107216055302, "min_success": 1.0, "decision": "MILESTONE", "decision_reason": "seed_val=100: 2043.8 (below training, zero overfit). Horizontal: beats all industry planners and random search by 27%. Robustness: +26~33% advantage across v* 0.6x-1.5x. Space formally EXHAUSTED at fixed point 2046.4; awaiting program.md direction."}
{"iter": 39, "kind": "rebaseline_s3a", "name": "S3a objective (accel+speed_profile)", "score": 2821.7, "min_success": 1.0, "decision": "BASELINE", "hypothesis": "objective 扩:每段速度可进化+提速动能代价;旧2046是旧口径,S3a新基线=当前config+v18平滑器+默认速度剖面"}
{"iter": 39, "kind": "speed", "name": "speed_profile v1: exact DP over discretized speeds (calibrated surrogate + rise-cost)", "hypothesis": "Riding vcap re-pays ~300J kinetic after every slow corner; marginal analysis (m*v/eff vs flat e/m near v*) puts optimal cruise BELOW v* (~12.7); an exact DP (40 levels x n segments, rise-priced, decel free) dominates trapezoid heuristics.", "score": 2565.8595483515633, "min_success": 1.0, "decision": "KEEP", "decision_reason": "score 2821.7->2565.9 (-9.1%), beats the smoothing-heuristic reference 2638. A 984/B 782/C 801. DP cruises at 12.7 with a single monotone-decreasing profile."}
