{"iter": 40, "kind": "code+episode", "name": "smoother v27: DP-cost topology ranker (geometry-speed co-optimization) [episode 7 EXPLORE: spatial-domain velocity DP lit]", "hypothesis": "With DP cruise ~12.7 < v*, corners with cap>=12.7 are free — the smoother's cap-riding ranking optimizes a dead objective; pricing geometry by its DP-optimal speed cost aligns topology/CHOMP/hop decisions with S3a.", "score": 2565.4675483190354, "min_success": 1.0, "decision": "KEEP", "decision_reason": "score 2565.9->2565.5 (+0.015%, sesame). Coupling real but tiny: old-objective geometry near-optimal under new objective too (binding caps sit below cruise). Honest half-negative for co-optimization."}
{"iter": 41, "kind": "speed", "name": "speed_profile v2: measured-grid bilinear lookup + finer levels (REJECTED)", "hypothesis": "DP is optimal given its cost table; killing the parabola's ±0.3 J/m fit error with the exact measured grid removes the last S3a error source.", "score": 2572.249502347504, "min_success": 1.0, "decision": "REVERT", "decision_reason": "score 2572.2 > 2565.5; A 986.5->993.3. Grid POINTS are exact but bilinear chords over the convex e/m curve overprice mid speeds (8x9 too coarse) — the smooth analytic fit interpolates better than the lookup. Third instance of the accurate-surrogate paradox."}
{"iter": 42, "kind": "speed", "name": "speed_profile v3: DENSE measured grid 31x11 (REJECTED)", "hypothesis": "v2's loss was bilinear chord error on the coarse grid; a dense grid (0.6 m/s x 15deg knots) shrinks it quadratically.", "score": 2571.591520809229, "min_success": 1.0, "decision": "REVERT", "decision_reason": "2571.6 > 2565.5; dense barely moved (A 993.3->992.6), still -6J vs parabola. Interpolation-error theory dead. New hypothesis for the record: compute_energy_for_segment likely has a segment-LENGTH nonlinearity (10m probe vs 25m real segments — internal ramp cost amortizing with L), so per-meter grids measured at fixed L mismatch; the loose parabola averages over it better. Parabola surrogate stays."}
{"iter": 43, "kind": "code+episode", "name": "smoother v28: speed-split pass (NO-OP) [episode 8 EXPLORE: waypoint-insertion lit + L-nonlinearity diagnostic]", "hypothesis": "Corner caps blanket whole segments; DP-cost-gated collinear splits confine them so the speed layer runs long portions fast. Diagnostic first: e/m is strictly length-independent (L-nonlinearity hypothesis DEAD); analytic parabola+sin surrogate error ~0.06 J/m at real slopes — speed layer already within ~3J of true optimum.", "score": 2565.4675483190354, "min_success": 1.0, "decision": "REVERT", "decision_reason": "byte-identical — A's remaining slow legs are slow at BOTH ends (consecutive descent corners), so splits confine nothing; earlier isolation passes already took every one-sided cap. S3a converged: speed within ~3J of optimum, geometry aligned, structure exhausted."}
{"iter": 44, "kind": "code", "name": "smoother v29: DP-cost sweep acceptance (REJECTED decisively)", "hypothesis": "v9's pessimistic-beats-accurate held under the old objective; under S3a the true objective diverges more from cap-riding — aligned sweeps may find shorter cap-12.7-sufficient geometry.", "score": 2748.4289501262847, "min_success": 1.0, "decision": "REVERT", "decision_reason": "2748.4 >> 2565.5 (A 986->1153). Pessimistic-surrogate principle CONFIRMED ACROSS OBJECTIVES: DP cost is flat near cruise -> weak/noisy acceptance signal -> local moves degrade structure. The pessimistic proxy's aggressive bias is load-bearing for local search; accurate surrogates belong in ranking/gradient roles only."}
{"iter": 45, "kind": "speed", "name": "speed_profile v4: continuous coordinate-descent polish after DP", "hypothesis": "DP levels are 0.25-0.5 m/s discrete; golden-section refinement between levels (full-profile cost, rise-coupled) recovers the discretization error at zero risk.", "score": 2557.4933601409607, "min_success": 1.0, "decision": "KEEP", "decision_reason": "2565.5->2557.5 (+0.31%); A 986.5->981.2, C 798.2->795.5. Sub-1% -> plateau 3 -> episode 9 boundary and Milestone 3 next."}
{"iter": 46, "kind": "speed+episode", "name": "speed_profile v5: pairwise block polish [episode 9 boundary: BCD lit]", "hypothesis": "Rise costs chain consecutive speeds; single-coordinate descent stalls where a pair raised together amortizes one rise — pairwise block updates are the standard BCD fix.", "score": 2556.466903109831, "min_success": 1.0, "decision": "KEEP", "decision_reason": "2557.5->2556.5 (+0.04%, sesame) — B/C crumbs. S3a speed layer now polished to convergence at every granularity. Milestone 3 next iteration."}
{"iter": 47, "kind": "milestone", "name": "Milestone 3 (episode 9): S3a wrap-up", "hypothesis": null, "score": 2556.466903109831, "min_success": 1.0, "decision": "MILESTONE", "decision_reason": "S3a 2821.7->2556.5 (-9.4%); held-out 2566.8 (+0.4%, no overfit); beats random search 8.4% (script protocol); robustness PARTIAL: geometry gains robust, speed-DP gain sensitive at v* 1.5x (honestly flagged — optimal cruise depends on the energy model by nature). S3a complete; awaiting S3b/S3c."}
{"iter": 48, "kind": "rebaseline_s3b", "name": "S3b generalize (6 train scenarios)", "score": 6066.1, "min_success": 1.0, "decision": "BASELINE", "hypothesis": "扩到程序化生成场景;A/B/C解泛化到gen300-302全100%,但生成场景能耗有空间;train=6场景,test=gen400-402留出"}
{"iter": 48, "kind": "code", "name": "smoother v30: goal-proximate f2 grid 0.97/0.985/0.995 (REJECTED, diagnostic)", "hypothesis": "gen300/302 goals sit ~2.7m behind Row4 — every f2<=0.95 descent anchor is inside the wall, so the over-wall probe never fires and they take 200-300J-worse lateral detours.", "score": 6834.248149210319, "min_success": 1.0, "decision": "REVERT", "decision_reason": "6834.2 >> 6066.1: templates fired but the ranker chose hook descents because the analytic proxy underprices STEEP-SLOW descent (measured: v=6@-60deg = 27.5 J/m vs level 19.4 — descent is a PENALTY below ~7 m/s, vortex-ring-like; my linear-in-sin credit predicts ~10). Next: speed-dependent descent-credit factor k(v)=clip((v-7)/4,-0.5,1) in the proxy, THEN retry late-f2."}
{"iter": 49, "kind": "code", "name": "smoother v31: hybrid descent pricing (analytic climb/level + measured grid steep-descent) + late-f2 retry", "hypothesis": "iter48's late-f2 templates were right but mispriced: analytic model misses the low-speed VRS penalty (v=6@-60deg costs 27.5 J/m, MORE than level); hybrid pricing (each model where it's right) lets the ranker adopt late descents only when genuinely cheaper.", "score": 6042.855889943083, "min_success": 1.0, "decision": "KEEP", "decision_reason": "6066.1->6042.9 (+0.38%). Disaster prevented, small net gain; with honest pricing the hook-descent route is genuinely NOT much cheaper for close-behind-wall goals (VRS penalty is real frozen-model physics). plateau+1."}
{"iter": 50, "kind": "code+episode", "name": "smoother v32: taut-shrink probe (NO-OP) [episode 10 EXPLORE: funnel/taut-string lit]", "hypothesis": "gen300/302 lateral routes swing to y~26-28 vs required ~20.5 (~15m overshoot); homotopy-preserving shrink toward the chord (funnel-style string tightening) recovers it.", "score": 6042.855889943083, "min_success": 1.0, "decision": "REVERT", "decision_reason": "byte-identical — shrunk candidates rank worse under the DP-cost ranker: the wide swing is CAP-OPTIMAL (extra length buys corner radius), same lesson as A's hump. Funnel intuition assumes min-length; this metric trades length for speed caps."}
{"iter": 51, "kind": "code", "name": "smoother v33: fine-DP adoption arbitration (REJECTED)", "hypothesis": "gen301 flaps topology by seed (seed2 OVER 976 vs seeds0/1 lateral 1012-1041); the 11-level coarse DP mis-prices marginal adoptions by ~the flap margin; fine-level arbitration at adoption points fixes it.", "score": 6074.748021103787, "min_success": 1.0, "decision": "REVERT", "decision_reason": "6074.7 > 6042.9 — gen301/302 both WORSE. FOURTH instance of the accurate-surrogate paradox, now at adoption level: coarse-DP bias protects marginal decisions like pessimism protects local moves. Pattern is now thesis-grade: biased estimators beat accurate ones at every decision level in this loop."}
{"iter": 52, "kind": "code", "name": "smoother v34: dual-objective skeleton probe (cap-aware + shortest)", "hypothesis": "Some seeds' raw skeletons polish into poor basins; a shortest-weighted skeleton alternative samples a second basin deterministically (unlike RNG basin hops), catching gen301's stuck-seed flap.", "score": 6030.135522582911, "min_success": 1.0, "decision": "KEEP", "decision_reason": "6042.9->6030.1 (+0.21%); gen301 1009.6->991.3 (flap partially fixed), gen300 -5.6 giveback, rest unchanged. Sub-1% -> plateau 3, episode 11 boundary next."}
{"iter": 53, "kind": "param+episode", "name": "step_size=4.0 re-probe on 6-scenario mix [episode 11 boundary: AC/portfolio lit + generalization mid-check]", "hypothesis": "Optimal parameters rarely transfer across instance distributions (AC literature); step_size=4.5 was tuned on 3 scenarios — the 6-scenario mix may prefer different. Also ran the overdue generalization check: gen400-402 all 100% at 955-1357J; seed100 only +3.0% — S3b's claim holds.", "score": 6284.533069554881, "min_success": 1.0, "decision": "REVERT", "decision_reason": "6284.5 >> 6030.1 worse everywhere — step_size=4.5 is ROBUST across the distribution shift (positive generalization finding). plateau 1."}
{"iter": 54, "kind": "code", "name": "smoother v35: final deterministic polish after STOMP", "hypothesis": "STOMP is the last stochastic stage and its output is never re-polished; a final sweeps->CHOMP round harvests its discoveries and damps per-seed variance.", "score": 6029.700441641118, "min_success": 1.0, "decision": "KEEP", "decision_reason": "6030.1->6029.7 (+0.007%, deep sesame) — gen302 only. Stochastic tail nearly clean. plateau 2."}
{"iter": 55, "kind": "code", "name": "smoother v36: top-4 template polish (REJECTED)", "hypothesis": "Raw template ranking mis-orders marginal cases; polishing one more candidate catches missed adoptions.", "score": 6171.552992400432, "min_success": 1.0, "decision": "REVERT", "decision_reason": "6171.6 >> 6029.7 — the 4th template WON on gen302 by proxy misjudgment (1255->1385 true). Fifth instance: tighter cuts protect against surrogate error. S3b converged at 6029.7; Milestone 4 next."}
{"iter": 56, "kind": "milestone", "name": "Milestone 4 (episode 12): S3b wrap-up", "hypothesis": null, "score": 6029.700441641118, "min_success": 1.0, "decision": "MILESTONE", "decision_reason": "S3b 6066.1->6029.7; generalization double-validated (gen400-402 100% @3337.5; seed100 +3.0%). Beats random search 8.4%. Robustness: geometry robust, speed-DP v*-sensitive at 1.5x (flagged). Biased-beats-accurate estimator pattern now systemic (5 instances). Awaiting S3c/S4."}
{"iter": 49, "kind": "reframe_s4a", "name": "open problem: non-Euclidean energy informed sampling", "score": 1419.4, "min_success": 1.0, "decision": "BASELINE", "hypothesis": "攻Kyaw&Kelly 2026开放问题:欧氏informed采样在非欧能量代价下不可采纳/过保守。用ctx.edge_cost利用能量各向异性加速收敛。均匀baseline1419.4。朴素cost-greedy已验证0%(过度集中)。"}
{"iter": 57, "kind": "sampler", "name": "sampler v1: energy-anisotropic informed ellipsoid (lateral-stretch/vertical-squash, iteration-annealed)", "hypothesis": "Euclidean informed set (symmetric prolate spheroid) is over-conservative under energy cost: it treats all perpendicular dirs equally, but level-flight lateral detours are energy-cheap while vertical excursions are expensive (climb unrecovered). So the energy-informed set stretches laterally, squashes vertically; c_best=None so transverse size anneals broad->tight over budget. Goal-bias 0.08 + annealed uniform fallback prevents the cost-greedy 0% collapse.", "score": 810.251748768885, "min_success": 1.0, "decision": "KEEP", "decision_reason": "1419.4->810.3 (-43%), success 1.0; held-out seeds(3,4)=804.6 (no overfit). Win on C (uniform 1618->814, -50%), B already near-optimal. Also 2s vs baseline 23s = genuinely faster convergence."}
{"iter": 58, "kind": "sampler+ablation", "name": "anisotropy ablation (symmetric Euclidean-informed) + ratio tuning", "hypothesis": "Prove anisotropy is load-bearing vs generic informed focusing (symmetric-ellipsoid ablation), and try pushing r_lat to beat 810.", "score": 810.251748768885, "min_success": 1.0, "decision": "REVERT", "decision_reason": "ABLATION: symmetric Euclidean-informed=1311.5 (-7.6% vs uniform) << anisotropic=810.3 (-43%) => anisotropy carries ~5/6 of gain (key evidence, kept as finding). Ratio tuning r_lat=2.5 improves train(801) but overfits heldout(3,4)=1689; r_lat=1.7 robust (804.6/801.5). REVERT tuning, keep v1."}
{"iter": 59, "kind": "sampler+diagnostic", "name": "headroom sizing + anneal-schedule scan", "hypothesis": "Size remaining headroom vs uniform convergence floor, and test if focusing faster improves first-connection quality.", "score": 810.251748768885, "min_success": 1.0, "decision": "REVERT", "decision_reason": "Uniform budget-flat at 1216 (RRT* breaks on first goal-connection => metric=first-solution-quality). v1@1500=810 beats uniform@6000=1216 (qualitatively better solution, key headline). Schedule scan: every variant worse or seed-unstable (p=0.25->train 1843); v1 (p0.38/m0.65) uniquely stable 810/804/801. REVERT; v1 robust optimum doubly-confirmed."}
{"iter": 60, "kind": "sampler+ablation-decomp+lit", "name": "ablation decomposition + sub-level-set rejection sampler (EXPLORE, Ep13)", "hypothesis": "Decompose the anisotropy ablation to correctly attribute the gain, and try the literature SOTA (energy sub-level-set rejection sampling, Kyaw&Kelly 2026) as a principled hand-tuning-free alternative.", "score": 810.251748768885, "min_success": 1.0, "decision": "REVERT", "decision_reason": "DECOMPOSITION: squash-only=816 (nearly all the gain), stretch-only=1128 (half) => vertical squash (planar concentration) is the lever, corrects iter57-58 over-crediting lateral stretch. Sub-level-set rejection sampler=1107 (worse than 810/816): energy metric barely penalizes gentle in-band slopes so it under-squashes; hand-tuned r_vert encodes a stronger correct planar prior. REVERT, keep v1; recorded as exploration seed (pure-metric method wins only on non-planar queries)."}
{"iter": 61, "kind": "sampler", "name": "goal-approach-cone (REVERT) + static-sampler exhaustion verdict", "hypothesis": "A goal-anchored approach cone (general, no obstacle knowledge) could smooth the first goal-connection's final approach angle and beat 810.", "score": 810.251748768885, "min_success": 1.0, "decision": "REVERT", "decision_reason": "goal-cone train=806.3 but heldout(3,4)=1282.6/(5,6,7)=836.9 -- 4th consecutive overfit. VERDICT: static-sampler space exhausted under ctx limits; v1(810) uniquely robust (810/804/801). S4a core result consolidated. Awaiting human: SOTA gate or S4b."}
{"iter": 62, "kind": "sampler", "name": "low-dispersion (R3 quasi-random) informed sampler (REVERT)", "hypothesis": "Low-dispersion coverage (deterministic sampling accelerates RRT, Janson et al.) targets the observed seed-fragility for a more robust mean.", "score": 810.251748768885, "min_success": 1.0, "decision": "REVERT", "decision_reason": "train=1066.4 (worse) though heldout 807/811 comparable -- inverse seed-profile of the overfitting variants, still fails to beat v1. 5th distinct attempt confirming v1(810) uniquely robust across ALL seed sets. S4a static-sampler space definitively exhausted; awaiting human direction."}
{"iter": 63, "kind": "sampler", "name": "annealed goal-bias (delayed first-connection) (REVERT)", "hypothesis": "RRT* breaks on first goal-connection (iter59); v1 connects early on an immature tree. Lowering goal-bias early delays connection until the tree matures through the corridor -> smoother first path.", "score": 810.251748768885, "min_success": 1.0, "decision": "REVERT", "decision_reason": "train=1556.8 (much worse), heldout 809.8/1008.0 -- delayed connection hurts most seeds. 6th distinct mechanism failing to beat v1(810); a genuinely-new lever (goal-bias timing) failing => v1 definitively the robust optimum. S4a exhausted; holding for human direction."}
