{"iter": 1, "kind": "baseline", "name": "steady BEMT", "search_ARE": 0.07040523920780196, "val_ARE": 0.06877334959011731, "decision": "BASELINE"}
{"iter": 1, "kind": "EXPLORE", "name": "BEMT momentum-theory (T^1.5 + T2/V + v3 + climb/desc asym)", "hypothesis": "baseline 1,v,v2 misfits U-shaped rotor power; momentum theory gives NON-polynomial induced branch (T^1.5 hover, T^2/V forward relief) + parasite v^3 + climb/desc asymmetry \u2014 a form a linear term-library cannot reach", "search_ARE": 0.045558021499615076, "val_ARE": 0.04246527826096678, "val_r2": 0.2513088560483819, "decision": "KEEP"}
{"iter": 2, "kind": "EXPLORE", "name": "full-Glauert bridge + air-relative(wind) + thrust-coupled climb", "hypothesis": "replace iter1 two induced terms with ONE physically-correct Glauert bridge T2/sqrt(vh2+T); couple wind via air-relative speed sqrt(vh2+wind2) into profile/parasite; climb as T*max(vz,0) interaction", "search_ARE": 0.04933607355664471, "val_ARE": 0.04905588687920126, "val_r2": 0.21436623352371406, "decision": "REVERT", "note": "WORSE than iter1 (4.56->4.93%). The single correct bridge removed a DOF the two-term induced split gave the linear fit; wind-quadrature + thrust-climb did not compensate. More-principled lost to looser form."}
{"iter": 3, "kind": "EXPLOIT", "name": "iter1 core + thrust-scaled profile T*v2 (v2*payload interaction)", "hypothesis": "add v2*payload coupling via thrust-scaled profile T*v_h2 on top of iter1 winning core (heavier craft -> higher RPM -> more profile power at speed); interaction is a preferred novel form", "search_ARE": 0.04544764719331403, "val_ARE": 0.042425607285726974, "val_r2": 0.2510170261150766, "decision": "KEEP", "note": "MARGINAL KEEP: search 4.5558->4.5448% (0.24% rel), val 4.2465->4.2426%. Interaction barely helps once induced/payload core present -> diminishing returns, plateau+1."}
{"iter": 4, "kind": "EXPLORE", "name": "iter3 + momentum-theory axial induced modulation (sqrt-of-sum, NON-poly)", "hypothesis": "climb lowers induced velocity v_i=-vz/2+sqrt((vz/2)^2+vi0^2), vi0^2~T; add T*(v_i-vi0) as non-polynomial vertical-induced signal beyond the polynomial library", "search_ARE": 0.04535164735466727, "val_ARE": 0.04231898866090918, "val_r2": 0.2512227493241882, "decision": "REVERT", "note": "NEAR-MISS: search 4.5448->4.5352% (only 0.096pp, BELOW 1e-4 keep-floor) and val 4.2426->4.2319% both improved but sub-significant -> REVERT. 2nd consecutive novel-form fail (after iter2 Glauert bridge). Honest boundary: compact induced+profile+parasite core ~4.24% ARE captures achievable kinematic signal; nonlinear refinements insignificant. plateau->3 => episode boundary next."}
{"iter": 5, "kind": "EXPLORE", "name": "episode1: air-relative speed v_air=sqrt(v_h^2+wind^2) for aero drag (wind test)", "hypothesis": "lit(Tseng/Rodrigues) says wind is key and dataset measured it; test if gap to ~1.9% poly frontier is just wind via air-relative airspeed replacing ground speed in profile/parasite/forward-relief", "search_ARE": 0.04540224487955565, "val_ARE": 0.04378231942012781, "val_r2": 0.25741627522531035, "decision": "REVERT", "note": "REVERT: search 4.5448->4.5402% flat but val ARE 4.2426->4.3782% WORSE despite R2 0.251->0.257. Wind-quadrature helps per-sample variance a hair but hurts per-flight energy ARE. Gap is NOT simple air-relative wind -> likely wind direction (head/tail cancel in quadrature)."}
{"iter": 6, "kind": "EXPLOIT", "name": "iter3 physics core + bare linear payload", "hypothesis": "diagnostic: single payload term=2.25% << physics-only 4.24%; physics loses because it forces payload into rigid T^1.5 shape. add bare linear payload -> should collapse to linear frontier, isolating that physics priors HURT by over-constraining payload->power", "search_ARE": 0.020080161079709422, "val_ARE": 0.019289395545069785, "val_r2": 0.4387519242363211, "decision": "KEEP", "note": "DECISIVE KEEP: search 4.5448->2.0080%, val 4.2426->1.9289%, R2 0.251->0.439 by adding ONE bare payload term. Now MATCHES full linear LIB (1.91%). Core finding: physics-nonlinear forms were NOT the value (were crippled by omitting linear payload); physics+payload(1.93%)~=pure-linear(1.91%). LLM physics reasoning neither beats nor clearly adds beyond flexible linear regression on real M100 energy. plateau->0."}
{"iter": 7, "kind": "EXPLORE", "name": "iter6 + payload*climb interaction (weight-scaled climb work, beyond LIB)", "hypothesis": "best is at linear frontier (1.93%~1.91%); climb work=weight*climb-rate=(m0+payload)*g*vz so heavier pays more per climb; LIB lacks payload*climb product; test if this beyond-LIB interaction beats ~1.9%", "search_ARE": 0.020077455719559444, "val_ARE": 0.01928783929754029, "val_r2": 0.4387362443845913, "decision": "REVERT", "note": "REVERT: identical to iter6 (search 2.0080->2.0077%, val 1.9289->1.9288%, delta 0.0003pp << 1e-4). payload*climb adds nothing to per-flight energy ARE (climb is small fraction of total energy). Confirms ~1.9% is the frontier; beyond-LIB interactions do not beat it."}
{"iter": 8, "kind": "diagnostic", "name": "full linear LIB + physics(T^1.5,T2/V) \u2014 does physics beat linear?", "hypothesis": "decisive test: add physics non-poly on top of full linear LIB; below 1.91% => physics adds value, else physics adds nothing/ hurts", "search_ARE": 0.01989021770250506, "val_ARE": 0.01962248461917964, "val_r2": 0.4586349201665543, "decision": "REVERT", "note": "DECISIVE: pure-linear LIB val=1.909% is BEST (beats physics+payload iter6 1.929%). Physics ATOP linear -> val 1.909->1.962% WORSE (collinear cols overfit search split; per-sample R2 up 0.46 but per-flight ARE down). Physics neither beats nor adds to linear; stacked it HURTS. REVERT (mechanical search-KEEP met but true val worse + linear-stacking against mandate). Strong honest boundary."}
{"iter": 9, "kind": "EXPLORE", "name": "iter6 + T^3 electrical I2R efficiency-loss (non-aero mechanism)", "hypothesis": "all prior novel forms aero/interaction & failed; try distinct ELECTRICAL mechanism: copper loss I2R ~ current^2 ~ (mech power)^2 ~ (T^1.5)^2 = T^3; non-LIB", "search_ARE": 0.02003588478573673, "val_ARE": 0.0196409348679163, "val_r2": 0.4392736031124536, "decision": "REVERT", "note": "REVERT: search 2.0080->2.0036% (0.0044pp, below 1e-4 floor), val 1.9289->1.9641% WORSE. T^3 collinear with T^1.5 over narrow mass range, overfits. Completes novel-form sweep: aero(induced/parasite/air-relative/axial) + interactions + electrical ALL fail to beat linear. plateau->3 => episode boundary next."}
{"iter": 10, "kind": "milestone", "name": "capstone defense-line comparison (baselines_energy.py)", "result": {"baseline": 0.0688, "full": 0.0191, "random": 0.0186, "greedy": 0.0209, "loop": 0.0186, "code_physics_payload": 0.0193, "code_physics_only": 0.0424}, "decision": "PAUSE-FOR-REVIEW", "note": "loop 1.86% ties random 1.86% (structure-search weak); beats greedy 2.09%. code-level physics(1.93%) worse than random linear(1.86%). Contribution = trustworthy framework + honest boundary, not better model. Cross-consistent with radar."}
{"iter": 11, "kind": "EXPLOIT", "name": "Tseng + asym climb/desc (vz^3 climb / vz^2 desc)", "hypothesis": "from knowledge-base winner Tseng(1.90%), break v_z symmetry: independent nonlinear scale for climb(vz^3) vs descent(vz^2) — beyond linear LIB", "search_ARE": 0.019881, "val_ARE": 0.019183, "val_r2": 0.443, "n_feat": 10, "decision": "REVERT", "note": "search 1.991->1.988% (0.003pp, marginal past 1e-4 floor), val 1.903->1.918% WORSE (+0.015pp > +0.003 guard). Asymmetric climb/descent exponents overfit search split; symmetric v_z² was better. Another novel-form fails to beat simple linear from a strong starting point."}
{"iter": 12, "kind": "EXPLORE", "name": "Tseng + piecewise hover/cruise (vh<2.5 segmented)", "hypothesis": "piecewise regime-split (hover vs cruise with independent scalings) — a structure linear polynomial library cannot express", "search_ARE": 0.02049, "val_ARE": 0.01876, "val_r2": 0.383, "n_feat": 11, "decision": "REVERT", "note": "PROTOCOL DISCIPLINE DEMO: piecewise better on ALL 3 val seeds (-0.006/-0.061/-0.014) but search mean worse (2.049 vs 1.991) due to seed0 spike (+0.347). Mechanical rule correctly REVERTs — val is a GUARD, never a selector (using val would leak it into selection → val-overfit). The piecewise structure may carry a tiny real signal (consistent val gain) but the protocol refuses to chase it; that is the anti-overfit discipline."}
